{
  "schemaVersion": "1.0",
  "tenantId": "11111111-1111-1111-1111-111111111111",
  "backendAudienceClientId": "33333333-3333-3333-3333-333333333333",
  "backendCallerClientIds": ["44444444-4444-4444-4444-444444444444"],
  "frontendResourceClientId": "55555555-5555-5555-5555-555555555555",
  "backendOrigin": "https://backend.synthetic.invalid",
  "apimOrigin": "https://apim.synthetic.invalid",
  "gatewayOrigin": "https://gateway.synthetic.invalid"
}
